{
  "schemaVersion": "action-map-revision/1",
  "requestId": "parse_orders_001",
  "patchId": "patch_orders_001",
  "idempotencyKey": "sha256:9bb83aa28261962a45302016f2ef9c040bbd057d5e8fc8cab73f3a02a1449f3b",
  "siteScopeId": "owned_account_orders",
  "sourceLayerSequence": 1,
  "application": {
    "status": "applied",
    "base": {
      "revision": 0,
      "digest": null
    },
    "result": {
      "revision": 1,
      "digest": "sha256:20fd07cfcf35702ec55664cb488e5928e4684bbb959d52efeae495dd12117492"
    },
    "current": {
      "revision": 1,
      "digest": "sha256:20fd07cfcf35702ec55664cb488e5928e4684bbb959d52efeae495dd12117492"
    },
    "conflictCode": null
  },
  "parser": {
    "parserId": "ambient_action_parser",
    "parserVersion": "1.0.0",
    "promptVersion": "ambient-v1"
  },
  "validation": {
    "validatorVersion": "ambient-contract-validator/1",
    "actionMapSchemaVersion": "action-map/1",
    "actionListSchemaVersion": "action-list/1",
    "checks": [
      "request_binding",
      "site_scope",
      "layer_sequence",
      "evidence_resolution",
      "executable_actions",
      "provenance",
      "privacy",
      "action_map_schema",
      "canonical_digest"
    ]
  },
  "storage": {
    "actionMapRevisionStored": true,
    "safeEvidenceMetadataCount": 2,
    "semanticXmlStored": false,
    "sanitizedObservationStored": false,
    "rawObservationStored": false
  },
  "appliedAt": "2026-09-03T12:10:01Z"
}
